{
  "schemaVersion": "jovra.quote/1",
  "quoteId": "quote-test-01",
  "projectId": "sample-court-day",
  "environment": "test",
  "sample": true,
  "illustrative": false,
  "planRevision": 2,
  "outputSpecSha256": "8e10e6614d128e6380090e9b206cac5e6ee800e17cce73cc23e823114efffb99",
  "inputsSha256": "511ea52c6e211cdcbe25300783c8ec4ca4c533215a3739bcf30f2d6bac25ea66",
  "filmClass": "story-2-3",
  "estimate": {
    "minCredits": 2,
    "maxCredits": 4
  },
  "capCredits": 4,
  "estimatedMaxCostMicroUsd": 1290000,
  "creditCostBudgetMicroUsd": 800000,
  "lineItems": {
    "sourceCount": 3,
    "uploadBytes": 10800000000,
    "storageDays": 7,
    "outputSeconds": 258,
    "renderMinutesEstimate": 30,
    "plannerTokensEstimate": 120000
  },
  "retentionDays": 7,
  "displayAmounts": null,
  "createdAt": "2026-10-07T22:45:00Z",
  "expiresAt": "2026-10-07T23:15:00Z",
  "status": "accepted",
  "acceptedAt": "2026-10-07T22:50:00Z",
  "consent": {
    "consentRecordId": "consent-upload-01",
    "uploadSelectedSources": true,
    "at": "2026-10-07T22:49:30Z"
  }
}
